{
  "id": "general-shop",
  "kind": "npc",
  "name": "General Shop",
  "summary": "The first village's everyday merchant.",
  "trust": "unconfirmed",
  "sources": [
    "wiki-items",
    "tay"
  ],
  "last_updated": "2026-10-27",
  "role": "merchant",
  "aka": [
    "Merchant, 1st village"
  ],
  "location": [
    "first-village"
  ],
  "sells": [
    {
      "item": "human-blood",
      "price_by_race": {
        "human": 50,
        "witch": 200,
        "vampire": 200
      }
    },
    {
      "item": "human-potion",
      "price_by_race": {
        "human": 50,
        "witch": 250,
        "vampire": 250
      }
    },
    {
      "item": "cup",
      "price": 450
    },
    {
      "item": "xp-booster",
      "price": 100000
    },
    {
      "item": "dish",
      "price": 450
    },
    {
      "item": "lantern",
      "price": 350
    },
    {
      "item": "metal-ring",
      "price": 5000
    },
    {
      "item": "pumpkin-lantern",
      "price": 400
    }
  ]
}
